link,bodies,zi,u_id,zi_left_up,zi_left,zi_left_down,zi_up,zi_mid,zi_down,zi_right_up,zi_right,zi_right_down,zi_mid_out,zi_mid_in,ts,desc_cn,is_active,id_shuowen,hsk_note,desc_en
M-R,2,㓝,13644,,,,,井,,,刂,,,,2024-01-21 08:56:56,罰辠也。从井从刀。《易》曰：“井，法也。”井亦聲。,Y,,,
M-R,2,㱍,13694,,,,,䜌,,,欠,,,,2024-01-21 12:39:29,欠皃。从欠䜌聲。,Y,,,
M-R,2,㲪,13591,,,,,登,,,毛,,,,2024-01-20 23:08:56,毾㲪也。从毛登聲。,Y,,,
M-R,2,䋣,13614,,,,,𣫭,,,糸,,,,2024-01-21 00:54:06,馬髦飾也。从糸𣫭聲。《春秋傳》曰：“可以稱旌緐乎？”,Y,,,
M-R,2,䫏,8228,,,,,其,,,页,,,,,醜也。从頁其聲。今逐疫有䫏頭。,Y,5660,,
M-R,2,䰰,13592,,,,,需,,,鬼,,,,2024-01-20 23:11:11,鬼鬽聲，䰰䰰不止也。从鬼需聲。,Y,,,
M-R,2,切,33,,,,,七,,,刀,,,,2024-01-21 09:01:06,刌也。从刀七聲。,Y,2748,in HSK,
M-R,2,刊,5870,,,,,干,,,刂,,,,2024-01-14 15:27:53,剟也。从刀干聲。,Y,2761,in HSK,
M-R,2,刌,36,,,,,寸,,,刂,,,,2024-01-28 22:43:14,切也。从刀寸聲。,Y,2749,,
M-R,2,刑,11182,,,,,幵,,,刂,,,,2024-01-15 12:29:19,剄也。从刀幵聲。,Y,2789,in HSK,
M-R,2,划,4609,,,,, 戈,,,刂,,,,2024-01-15 13:09:43,,Y,,from HSK,to cut/to slash/to scratch (cut into the surface of sth)/to strike (a match)
M-R,2,列,6647,,,,,歹,,,刂,,,,2024-01-15 13:14:41,分解也。从刀𡿪聲。,Y,2760,in HSK,
M-R,2,刘,6766,,,,,文,,,刂,,,,2024-01-15 13:15:11,,Y,,from HSK,(classical) a type of battle-ax/to kill/to slaughter
M-R,2,则,137,,,,,贝,,,刂,,,,2024-01-15 12:44:50,,Y,,from HSK,(literary) (conjunction used to express contrast with a previous clause) but;  then/(bound form) standard
M-R,2,刚,3841,,,,,冈,,,刂,,,,2024-01-15 13:05:54,,Y,,from HSK,hard/firm/strong/just/barely/exactly
M-R,2,创,2487,,,,,仓,,,刂,,,,2024-01-15 12:58:41,,Y,,from HSK,a wound/cut/injury/trauma
M-R,2,删,9115,,,,,册,,,刂,,,,2024-01-23 22:49:49,,Y,,from HSK,to delete
M-R,2,刡,61,,,,,民,,,刂,,,,2024-02-13 22:17:27,,Y,,,
M-R,2,判,7893,,,,,半,,,刂,,,,2024-01-23 22:46:42,分也。从刀半聲。,Y,2757,in HSK,
M-R,2,別,13903,,,,,另,,,刂,,,,2024-01-28 11:41:05,,Y,,,
M-R,2,刨,1529,,,,,包,,,刂,,,,2024-01-27 23:42:48,,Y,,from HSK,carpenter's plane/to plane (woodwork)/to shave off/to peel (with a potato peeler etc)
M-R,2,利,6458,,,,,禾 ,,,刂,,,,2024-01-18 02:18:45,,Y,,from HSK,sharp/favorable/advantage/benefit/profit/interest/to do good to/to benefit
M-R,2,别,1792,,,,,另 ,,,刂,,,,2024-01-18 01:56:44,,Y,,from HSK,"to leave; to part (from)/(literary) to differentiate; to distinguish/(bound form) other; another; different/don't ...!/to fasten with a pin or clip/to stick in; to insert (in order to hinder movement)/(noun suffix) category (e.g. 性別|性别[xing4 bie2], 派別|派别[pai4 bie2])"
M-R,2,刮,4105,,,,,舌,,,刂,,,,2024-01-26 16:02:49,掊把也。从刀𠯑聲。,Y,2773,in HSK,
M-R,2,到,125,,,,,至,,,刂,,,,2024-01-21 09:02:04,至也。从至刀聲。,Y,7669,in HSK,
M-R,2,刹,2066,,,,,杀,,,刂,,,,2024-01-28 10:09:59,,Y,,from HSK,"""Buddhist monastery, temple or shrine (abbr. for 剎多羅|刹多罗[cha4 duo1 luo2], Sanskrit """"ksetra"""")"""
M-R,2,刺,2594,,,,,朿,,,刂,,,,2024-01-26 15:57:20,君殺大夫曰刺。刺，直傷也。从刀从朿，朿亦聲。,Y,2794,in HSK,
M-R,2,刻,5958,,,,,亥,,,刂,,,,2024-01-26 22:39:56,鏤也。从刀亥聲。,Y,2753,in HSK,
M-R,2,刽,4213,,,,,会,,,刂,,,,2024-01-28 10:13:22,,Y,,from HSK,to amputate/to cut off/also pr. [kuai4]
M-R,2,剂,4982,,,,,齐,,,刂,,,,2024-01-26 22:35:23,,Y,,from HSK,dose (medicine)
M-R,2,剃,10007,,,,,弟,,,刂,,,,2024-01-27 01:25:56,,Y,,from HSK,to shave
M-R,2,削,11019,,,,,肖,,,刂,,,,2024-01-27 00:28:27,鞞也。一曰析也。从刀肖聲。,Y,2735,in HSK,
M-R,2,剌,6189,,,,,束,,,刂,,,,2024-01-27 17:34:44,戾也。从束从刀。刀者，剌之也。,Y,3884,,
M-R,2,剑,5194,,,,,佥,,,刂,,,,2024-01-26 23:52:39,,Y,,from HSK,"double-edged sword/CL:口[kou3],把[ba3]/classifier for blows of a sword"
M-R,2,剔,9977,,,,,易 ,,,刂,,,,2024-01-18 01:12:07,解骨也。从刀易聲。,Y,2795,in HSK,
M-R,2,剖,8180,,,,,咅,,,刂,,,,2024-01-27 10:42:43,判也。从刀咅聲。,Y,2755,in HSK,
M-R,2,剥,1504,,,,,录,,,刂,,,,2024-01-27 10:05:38,,Y,,from HSK,to peel/to skin/to shell/to shuck
M-R,2,剧,5685,,,,,居,,,刂,,,,2024-01-27 10:32:19,,Y,,from HSK,"theatrical work (play, opera, TV series etc)/dramatic (change, increase etc)/acute/severe"
M-R,2,剩,9316,,,,,乘,,,刂,,,,2024-01-27 17:47:23,,Y,,from HSK,to remain/to be left/to have as remainder
M-R,2,副,3743,,,,,畐,,,刂,,,,2024-01-27 10:10:21,判也。从刀畐聲。《周禮》曰：“副辜祭。”,Y,2754,in HSK,
M-R,2,割,3894,,,,,害,,,刂,,,,2024-01-27 18:48:10,剥也。从刀害聲。,Y,2766,in HSK,
M-R,2,剿,2179,,,,,巢,,,刂,,,,2024-01-28 14:50:28,,Y,,from HSK,to plagiarize
M-R,2,劬,8702,,,,,句,,,力,,,,,勞也。从力句聲。,Y,9205,,
M-R,2,劭,9206,,,,,召,,,力,,,,,勉也。从力召聲。讀若舜樂《韶》。,Y,9179,,
M-R,2,劼,5389,,,,,吉,,,力,,,,,愼也。从力吉聲。《周書》曰：“汝劼毖殷獻臣。”,Y,9171,,
M-R,2,劾,4389,,,,,亥,,,力,,,,,法有辠也。从力亥聲。,Y,9203,,
M-R,2,勃,1871,,,,,孛,,,力,,,,,排也。从力孛聲。,Y,9199,in HSK,
M-R,2,勉,7336,,,,,免,,,力,,,,,彊也。从力免聲。,Y,9178,in HSK,
M-R,2,勋,11403,,,,,员,,,力,,,,2024-01-28 11:03:15,,Y,,from HSK,medal/merit
M-R,2,勍,8597,,,,,京,,,力,,,,,彊也。《春秋傳》曰：“勍敵之人。”从力京聲。,Y,9176,,
M-R,2,勖,11296,,,,,冒,,,力,,,,,勉也。《周書》曰：“勖哉，夫子！”从力冒聲。,Y,9180,,
M-R,2,勘,5871,,,,,甚,,,力,,,,,校也。从力甚聲。,Y,9207,in HSK,
M-R,2,勠,6900,,,,,翏,,,力,,,,,并力也。从力翏聲。,Y,9184,,
M-R,2,勤,8555,,,,,堇,,,力,,,,2024-01-27 19:03:08,勞也。从力𡏳聲。,Y,9195,in HSK,
M-R,2,卦,4115,,,,,圭,,,卜,,,,2024-01-27 23:49:56,筮也。从卜圭聲。,Y,2067,in HSK,
M-R,2,卧,10593,,,,,臣,,,卜,,,,2024-01-26 16:34:43,,Y,,from HSK,to lie/to crouch
M-R,2,即,4926,,,,,艮 ,,,卩,,,,2024-01-18 02:13:50,,Y,,from HSK,namely/that is/i.e./prompt/at once/at present/even if/prompted (by the occasion)/to approach/to come into contact/to assume (office)/to draw near
M-R,2,却,8784,,,,,去 ,,,卩,,,,2024-01-16 23:46:57,,Y,,from HSK,but/yet/however/while/to go back/to decline/to retreat/nevertheless/even though
M-R,2,尨,7111,,,,,犬,,,彡,,,,2024-01-20 13:02:46,犬之多毛者。从犬从彡。《詩》曰：“無使尨也吠。”,Y,6272,,
M-R,2,引,12040,,,,,弓,,,丨,,,,2024-01-15 12:31:41,,Y,,from HSK,"to draw (e.g. a bow)/to pull/to stretch sth/to extend/to lengthen/to involve or implicate in/to attract/to lead/to guide/to leave/to provide evidence or justification for/old unit of distance equal to 10 丈[zhang4], one-thirtieth of a km or 33.33 meters"
M-R,2,形,11184,,,,,幵,,,彡,,,,2024-01-17 00:02:39,象形也。从彡幵聲。,Y,5684,in HSK,
M-R,2,彩,1951,,,,,采,,,彡,,,,2024-01-27 12:00:58,文章也。从彡采聲。,Y,5692,in HSK,
M-R,2,彬,6,,,,,林,,,彡,,,,2024-01-28 11:34:11,,Y,,from HSK,urbane;  well-bred
M-R,2,戉,12463,,,,,𠄌,,,戈,,,,,斧也。从戈𠄌聲。《司馬法》曰：“夏執玄戉，殷執白戚，周左杖黃戉，右秉白髦。”凡戉之屬皆从戉。”,Y,8358,,
M-R,2,戎,8891,,,,,十,,,戈,,,,2024-01-27 01:20:47,,Y,,,
M-R,2,戕,8444,,,,,爿,,,戈,,,,,搶也。他國臣來弑君曰戕。从戈爿聲。,Y,8347,,
M-R,2,或,4851,,,,,口一,,,戈,,,,2024-01-27 11:12:56,邦也。从囗从戈，以守一。一，地也。,Y,8344,in HSK,
M-R,2,戠,12979,,,,,音,,,戈,,,,,闕。从戈从音。,Y,8356,,
M-R,2,戡,5873,,,,,甚,,,戈,,,,,刺也。从戈甚聲。,Y,8349,,
M-R,2,戢,4936,,,,,咠,,,戈,,,,,藏兵也。从戈咠聲。《詩》曰：“載戢干戈。”,Y,8355,,
M-R,2,戣,6112,,,,,癸,,,戈,,,,,《周禮》：侍臣執戣，立于東垂。兵也。从戈癸聲。,Y,8335,,
M-R,2,戭,11575,,,,,寅,,,戈,,,,,長搶也。从戈寅聲。《春秋傳》有擣戭。,Y,8350,,
M-R,2,戮,6903,,,,,翏,,,戈,,,,,殺也。从戈翏聲。,Y,8348,,
M-R,2,所,9785,,,,,戶,,,斤,,,,,伐木聲也。从斤戶聲。《詩》曰：“伐木所所。”,Y,9435,in HSK,
M-R,2,改,3792,,,,,己,,,攵,,,,2024-01-21 08:50:09,,Y,,from HSK,to change/to alter/to transform/to correct
M-R,2,攺,11866,,,,,巳,,,攵,,,,,㱾改，大剛卯，以逐鬼鬽也。从攴巳聲。讀若巳。,Y,2056,,
M-R,2,攻,3985,,,,,工,,,攵,,,,2024-01-21 08:49:27,擊也。从攴工聲。,Y,2044,in HSK,
M-R,2,攽,1452,,,,,分,,,攵,,,,,分也。从攴分聲。《周書》曰：“乃惟孺子攽。”亦讀與彬同。,Y,2006,,
M-R,2,放,3500,,,,,方,,,攵,,,,,逐也。从攴方聲。凡放之屬皆从放。,Y,2503,in HSK,
M-R,2,政,12936,,,,,正,,,攵,,,,,正也。从攴从正，正亦聲。,Y,1998,in HSK,
M-R,2,敃,166,,,,,民,,,攵,,,,,彊也。从攴民聲。,Y,1992,,
M-R,2,故,4096,,,,,古,,,攵,,,,,使爲之也。从攴古聲。,Y,1997,in HSK,
M-R,2,敇,2343,,,,,朿,,,攵,,,,,擊馬也。从攴朿聲。,Y,2061,,
M-R,2,效,11065,,,,,交,,,攵,,,,,象也。从攴交聲。,Y,1996,in HSK,
M-R,2,敉,7299,,,,,米,,,攵,,,,,撫也。从攴米聲。《周書》曰：“亦未克敉公功。”讀若弭。,Y,2028,,
M-R,2,敏,194,,,,,每,,,攵,,,,,疾也。从攴每聲。,Y,1991,in HSK,
M-R,2,救,5614,,,,,求,,,攵,,,,,止也。从攴求聲。,Y,2022,in HSK,
M-R,2,敔,12303,,,,,吾,,,攵,,,,,禁也。一曰樂器，椌楬也，形如木虎。从攴吾聲。,Y,2051,,
M-R,2,敕,2344,,,,,束,,,攵,,,,,誡也。臿地曰敕。从攴束聲。,Y,2014,,
M-R,2,敛,6554,,,,,佥,,,攵,,,,2024-01-28 13:00:00,,Y,,from HSK,to hold back/to restrain/to control (oneself)/to collect/Taiwan pr. [lian4]
M-R,2,敜,7724,,,,,念,,,攵,,,,,塞也。从攴念聲。《周書》曰：“敜乃穽。”,Y,2038,,
M-R,2,敝,1659,,,,,㡀,,,攵,,,,,帗也。一曰敗衣。从攴从㡀，㡀亦聲。,Y,4919,,
M-R,2,敞,2169,,,,,尚,,,攵,,,,,平治高土，可以遠望也。从攴尚聲。,Y,2009,in HSK,
M-R,2,敦,3243,,,,,享,,,攵,,,,2024-01-21 08:44:38,怒也。詆也。一曰誰何也。从攴𦎫聲。,Y,2031,in HSK,
M-R,2,敲,8486,,,,,高,,,攴,,,,2024-01-27 21:55:51,橫擿也。从攴高聲。,Y,2045,in HSK,
M-R,2,敳,1288,,,,,豈,,,攵,,,,,有所治也。从攴豈聲。讀若豤。,Y,2008,,
M-R,2,敵,13642,,,,,舌,,,攵,,,,2024-01-21 08:48:55,仇也。从攴啻聲。,Y,,,
M-R,2,敷,3640,,,,,旉,,,攵,,,,2024-01-25 02:11:57,,Y,,from HSK,"to spread/to lay out/to apply (powder, ointment etc)/sufficient (to cover)/enough"
M-R,2,敹,6613,,,,,𥹄,,,攵,,,,,擇也。从攴𥹄聲。《周書》曰：“敹乃甲胄。”,Y,2017,,
M-R,2,敿,5313,,,,,喬,,,攵,,,,,繫連也。从攴喬聲。《周書》曰：“敿乃干。”讀若矯。,Y,2018,,
M-R,2,斁,11914,,,,,睪,,,攵,,,,,解也。从攴睪聲。《詩》云：“服之無斁。”斁，猒也。一曰終也。,Y,2024,,
M-R,2,斛,4551,,,,,角,,,斗,,,,,十斗也。从斗角聲。,Y,9443,,
M-R,2,斜,11092,,,,,余,,,斗,,,,,杼也。从斗余聲。讀若荼。,Y,9451,in HSK,
M-R,2,斞,12305,,,,,臾,,,斗,,,,,量也。从斗臾聲。《周禮》曰：“桼三斞。”,Y,9446,,
M-R,2,斟,12854,,,,,甚,,,斗,,,,,勺也。从斗甚聲。,Y,9450,in HSK,
M-R,2,斠,5345,,,,,冓,,,斗,,,,,平斗斛也。从斗冓聲。,Y,9449,,
M-R,2,斡,10586,,,,,倝,,,斗,,,,,蠡柄也。从斗倝聲。楊雄、杜林說：皆以爲軺車輪斡。,Y,9447,,
M-R,2,斨,8446,,,,,爿,,,斤,,,,,方銎斧也。从斤爿聲。《詩》曰：“又缺我斨。”,Y,9429,,
M-R,2,斫,13321,,,,,石,,,斤,,,,,擊也。从斤石聲。,Y,9430,,
M-R,2,斮,13320,,,,,昔,,,斤,,,,,斬也。从斤昔聲。,Y,9437,,
M-R,2,斯,9578,,,,,其,,,斤,,,,,析也。从斤其聲。《詩》曰：“斧以斯之。”,Y,9436,in HSK,
M-R,2,斸,13190,,,,,屬,,,斤,,,,,斫也。从斤屬聲。,Y,9432,,
M-R,2,朙,7423,,,,,囧,,,月,,,,2024-01-20 04:45:56,照也。从月从囧。凡朙之屬皆从朙。,Y,4304,,
M-R,2,欣,11152,,,,,斤,,,欠,,,,,笑喜也。从欠斤聲。,Y,5510,in HSK,
M-R,2,欥,13689,,,,,曰,,,欠,,,,2024-01-21 12:36:03,詮詞也。从欠从曰，曰亦聲。《詩》曰：“欥求厥寕。”,Y,,,
M-R,2,欨,11261,,,,,句,,,欠,,,,,吹也。一曰笑意。从欠句聲。,Y,5502,,
M-R,2,欬,5867,,,,,亥,,,欠,,,,,屰气也。从欠亥聲。,Y,5551,,
M-R,2,欱,4384,,,,,合,,,欠,,,,,歠也。从欠合聲。,Y,5547,,
M-R,2,欲,12328,,,,,谷,,,欠,,,,,貪欲也。从欠谷聲。,Y,5514,in HSK,
M-R,2,欶,9562,,,,,束,,,欠,,,,,吮也。从欠束聲。,Y,5544,,
M-R,2,欸,1294,,,,,矣,,,欠,,,,,訾也。从欠矣聲。,Y,5529,,
M-R,2,欺,8242,,,,,其,,,欠,,,,,詐欺也。从欠其聲。,Y,5560,in HSK,
M-R,2,欻,2462,,,,,炎,,,欠,,,,,有所吹起。从欠炎聲。讀若忽。,Y,5523,,
M-R,2,欿,5885,,,,,臽,,,欠,,,,,欲得也。从欠臽聲。讀若貪。,Y,5546,,
M-R,2,歁,5886,,,,,甚,,,欠,,,,,食不滿也。从欠甚聲。讀若坎。,Y,5545,,
M-R,2,歃,9102,,,,,臿,,,欠,,,,,歠也。从欠臿聲。《春秋傳》曰：“歃而忘。”,Y,5543,,
M-R,2,歆,11153,,,,,音,,,欠,,,,,神食气也。从欠音聲。,Y,5561,,
M-R,2,歇,11072,,,,,曷,,,欠,,,,,息也。一曰气越泄。从欠曷聲。,Y,5508,in HSK,
M-R,2,歈,12250,,,,,俞,,,欠,,,,,歌也。从欠俞聲。《切韻》云：“巴歈，歌也。”案：《史記》：渝水之人善歌舞，漢高祖采其聲。後人因加此字。,Y,5562,,
M-R,2,歉,8432,,,,,兼,,,欠,,,,,歉食不滿。从欠兼聲。,Y,5548,in HSK,
M-R,2,歌,3900,,,,,哥,,,欠,,,,,詠也。从欠哥聲。,Y,5515,in HSK,
M-R,2,歔,11263,,,,,虚,,,欠,,,,,欷也。从欠虚聲。一曰出气也。,Y,5532,,
M-R,2,歕,7964,,,,,賁,,,欠,,,,,吹气也。从欠賁聲。,Y,5507,,
M-R,2,歗,11066,,,,,肅,,,欠,,,,,吟也。从欠肅聲。《詩》曰：“其歗也謌。”,Y,5526,,
M-R,2,歙,9231,,,,,翕,,,欠,,,,,縮鼻也。从欠翕聲。丹陽有歙縣。,Y,5553,,
M-R,2,歜,2453,,,,,蜀,,,欠,,,,,盛气怒也。从欠蜀聲。,Y,5534,,
M-R,2,毡,12715,,,,,毛,,,占,,,,2024-01-28 11:06:33,,Y,,from HSK,felt (fabric)
M-R,2,毦,13589,,,,,耳,,,毛,,,,2024-01-20 23:05:21,羽毛飾也。从毛耳聲。,Y,,,
M-R,2,毹,9465,,,,,俞,,,毛,,,,2024-01-20 23:06:01,氍毹也。从毛俞聲。,Y,5369,,
M-R,2,氍,8705,,,,,瞿,,,毛,,,,2024-01-20 23:07:48,氍毹、毾㲪，皆氊緂之屬，蓋方言也。从毛瞿聲。,Y,5368,,
M-R,2,牧,7527,,,,,牛,,,攵,,,,,養牛人也。从攴从牛。《詩》曰：“牧人乃夢。”,Y,2060,in HSK,
M-R,2,献,10955,,,,,南,,,犬,,,,2024-01-27 19:32:31,,Y,,from HSK,to offer/to present/to dedicate/to donate/to show/to put on display/worthy person (old)
M-R,2,獻,13578,,,,,鬳,,,犬,,,,2024-01-20 22:39:36,宗廟犬名羹獻。犬肥者以獻之。从犬鬳聲。,Y,,,
M-R,2,琂,13649,,,,,王,,,言,,,,2024-02-13 22:31:39,石之似玉者。从玉言聲。,Y,,,
M-R,2,瓤,8826,,,,,襄,,,瓜,,,,2024-01-28 13:43:03,,Y,,from HSK,pulp (of fruit)/sth inside a covering/bad/weak
M-R,2,瓬,3495,,,,,方,,,瓦,,,,,周家搏埴之工也。从瓦方聲。讀若㧚破之㧚。,Y,8410,,
M-R,2,瓴,6731,,,,,令,,,瓦,,,,,瓮，似瓶也。从瓦令聲。,Y,8421,,
M-R,2,瓵,11836,,,,,台,,,瓦,,,,,甌瓿謂之瓵。从瓦台聲。,Y,8415,,
M-R,2,瓿,1935,,,,,咅,,,瓦,,,,,甂也。从瓦咅聲。,Y,8424,,
M-R,2,甄,12863,,,,,垔,,,瓦,,,,,匋也。从瓦垔聲。,Y,8411,,
M-R,2,甑,12646,,,,,曾,,,瓦,,,,,甗也。从瓦曾聲。,Y,8413,,
M-R,2,甗,11584,,,,,鬳,,,瓦,,,,,甑也。一曰穿也。从瓦鬳聲。讀若言。,Y,8414,,
M-R,2,翊,11940,,,,,立,,,羽,,,,2024-01-21 01:32:24,飛㒵。从羽立聲。,Y,2255,,
M-R,2,翎,6735,,,,,令,,,羽,,,,2024-01-21 01:32:53,羽也。从羽令聲。,Y,2268,in HSK,
M-R,2,翔,10995,,,,,羊,,,羽,,,,2024-01-21 01:28:00,回飛也。从羽羊聲。,Y,2259,in HSK,
M-R,2,翩,8073,,,,,扁,,,羽,,,,2024-01-21 01:21:44,疾飛也。从羽扁聲。,Y,2253,in HSK,
M-R,2,翮,4403,,,,,鬲,,,羽,,,,2024-01-21 01:35:16,羽莖也。从羽鬲聲。,Y,2245,,
M-R,2,翱,1360,,,,,皐,,,羽,,,,2024-01-21 01:27:47,翱翔也。从羽皐聲。,Y,2258,,
M-R,2,翹,13628,,,,,堯,,,羽,,,,2024-01-21 01:19:51,尾長毛也。从羽堯聲。,Y,,,
M-R,2,翻,3437,,,,,番,,,羽,,,,2024-01-21 01:33:46,飛也。从羽番聲。或从飛。,Y,2267,in HSK,
M-R,2,翽,13630,,,,,歲,,,羽,,,,2024-01-21 01:28:16,飛聲也。从羽歲聲。《詩》曰：“鳳皇于飛，翽翽其羽。”,Y,,,
M-R,2,翾,11340,,,,,瞏,,,羽,,,,2024-01-21 01:34:24,小飛也。从羽瞏聲。,Y,2250,,
M-R,2,翿,2891,,,,,寿,,,羽,,,,2024-01-21 01:30:09,翳也。所以舞也。从羽𣪐聲。《詩》曰：“左執翿。”,Y,2264,,
M-R,2,耶,11746,,,,,耳,,,⻏,,,,2024-01-28 13:17:10,,Y,,,
M-R,2,虓,11039,,,,,九,,,虎,,,,,虎鳴也。一曰師子。从虎九聲。,Y,3111,,
M-R,2,號,13569,,,,,号,,,虎,,,,2024-01-20 21:32:11,呼也。从号从虎。,Y,,,
M-R,2,虢,528,,,,,寽,,,虎,,,,,虎所攫畫明文也。从虎寽聲。,Y,3114,,
M-R,2,虩,10833,,,,,𡭴,,,虎,,,,,《易》：“履虎尾虩虩。”恐懼。一曰蠅虎也。从虎𡭴聲。,Y,3113,,
M-R,2,虺,4749,,,,,兀,,,虫,,,,2024-01-18 22:25:50,虺以注鳴。《詩》曰：“胡爲纵蜥。”从虫兀聲。,Y,8757,,
M-R,2,觓,13565,,,,,角,,,丩,,,,2024-01-20 21:14:12,角皃。从角丩聲。《詩》曰：“兕觵其觓。”,Y,,,
M-R,2,赦,9239,,,,,赤,,,攵,,,,,置也。从攴赤聲。,Y,2025,in HSK,
M-R,2,邗,4302,,,,,干,,,阝,,,,,國也，今屬臨淮。从邑干聲。一曰邗本屬吳。,Y,4123,,
M-R,2,邘,12281,,,,,于,,,阝,,,,,周武王子所封。在河内野王是也。从邑于聲。又讀若區。,Y,4031,,
M-R,2,邙,742,,,,,亡,,,阝,,,,,河南洛陽北亡山上邑。从邑亡聲。,Y,4026,,
M-R,2,邛,8630,,,,,工,,,阝,,,,,邛地。在濟陰縣。从邑工聲。,Y,4107,,
M-R,2,邠,1807,,,,,分,,,阝,,,,,周太王國。在右扶風美陽。从邑分聲。,Y,4003,,
M-R,2,邡,459,,,,,方,,,阝,,,,,什邡，廣漢縣。从邑方聲。,Y,4087,,
M-R,2,邦,1484,,,,,丰,,,阝,,,,,國也。从邑丰聲。,Y,3987,in HSK,
M-R,2,邧,12438,,,,,元,,,阝,,,,,鄭邑也。从邑元聲。,Y,4109,,
M-R,2,邨,405,,,,,屯,,,阝,,,,,地名。从邑屯聲。,Y,4154,,
M-R,2,邪,11102,,,,,牙,,,阝,,,,2024-01-15 13:33:03,琅邪郡。从邑牙聲。,Y,4130,in HSK,
M-R,2,邮,12198,,,,,由,,,阝,,,,2024-01-17 00:10:56,左馮翊高陵。从邑由聲。,Y,4018,in HSK,post
M-R,2,邯,4303,,,,,甘,,,阝,,,,,趙邯鄲縣。从邑甘聲。,Y,4048,,
M-R,2,邰,970,,,,,台,,,阝,,,,,炎帝之後，姜姓所封，周棄外家國。从邑台聲。右扶風斄縣是也。《詩》曰：“有邰家室。”,Y,4001,,
M-R,2,邱,8640,,,,,丘,,,阝,,,,,地名。从邑丘聲。,Y,4141,,
M-R,2,邲,341,,,,,必,,,阝,,,,,晉邑也。从邑必聲。《春秋傳》曰：“晋楚戰于邲。”,Y,4037,,
M-R,2,邳,8012,,,,,丕,,,阝,,,,,奚仲之後，湯左相仲虺所封國。在魯辥縣。从邑丕聲。,Y,4121,,
M-R,2,邴,1837,,,,,丙,,,阝,,,,,宋下邑。从邑丙聲。,Y,4099,,
M-R,2,邵,903,,,,,召,,,阝,,,,,晉邑也。从邑召聲。,Y,4033,,
M-R,2,邶,1576,,,,,北,,,阝,,,,,故商邑。自河内朝歌以北是也。从邑北聲。,Y,4030,,
M-R,2,邸,2969,,,,,氐,,,阝,,,,,屬國舍。从邑氐聲。,Y,3994,,
M-R,2,邻,6688,,,,,令,,,阝,,,,2024-01-23 22:37:27,,Y,,from HSK,neighbor/adjacent/close to  to draw near to/to add  to sum up/to comb (hair)
M-R,2,邽,518,,,,,圭,,,阝,,,,,隴西上邽也。从邑圭聲。,Y,4020,,
M-R,2,邾,13168,,,,,朱,,,阝,,,,,江夏縣。从邑朱聲。,Y,4080,,
M-R,2,邿,9338,,,,,寺,,,阝,,,,,附庸國。在東平亢父邿亭。从邑寺聲。《春秋傳》曰：“取邿。”,Y,4115,,
M-R,2,郁,214,,,,,有,,,阝,,,,,右扶風郁夷也。从邑有聲。,Y,4005,in HSK,
M-R,2,郃,4407,,,,,合,,,阝,,,,,左馮翊郃陽縣。从邑合聲。《詩》曰：“在郃之陽。”,Y,4013,,
M-R,2,郅,13070,,,,,至,,,阝,,,,,北地郁郅縣。从邑至聲。,Y,4055,,
M-R,2,郇,11439,,,,,旬,,,阝,,,,,周武王子所封國，在晉地。从邑旬聲。讀若泓。,Y,4050,,
M-R,2,郈,553,,,,,后,,,阝,,,,,東平無鹽鄉。从邑后聲。,Y,4125,,
M-R,2,郊,5295,,,,,交,,,阝,,,,,距國百里爲郊。从邑交聲。,Y,3993,in HSK,
M-R,2,郎,6282,,,,,良,,,阝,,,,,魯亭也。从邑良聲。,Y,4120,in HSK,
M-R,2,郑,12942,,,,,关,,,阝,,,,2024-01-26 23:10:26,,Y,,from HSK,bound form used in 鄭重|郑重[zheng4 zhong4] and 雅鄭|雅郑[ya3 zheng4]
M-R,2,郔,1104,,,,,延,,,阝,,,,,鄭地。从邑延聲。,Y,4110,,
M-R,2,郕,382,,,,,成,,,阝,,,,,魯孟氏邑。从邑成聲。,Y,4117,,
M-R,2,郗,385,,,,,希,,,阝,,,,,周邑也。在河内。从邑希聲。,Y,4028,,
M-R,2,郙,3732,,,,,甫,,,阝,,,,,汝南上蔡亭。从邑甫聲。,Y,4163,,
M-R,2,郚,10620,,,,,吾,,,阝,,,,,東海縣。故紀矦之邑也。从邑吾聲。,Y,4127,,
M-R,2,郛,3707,,,,,孚,,,阝,,,,,郭也。从邑孚聲。,Y,3995,,
M-R,2,郜,488,,,,,告,,,阝,,,,,周文王子所封國。从邑告聲。,Y,4105,,
M-R,2,郝,536,,,,,赤,,,阝,,,,,右扶風鄠、盩厔鄉。从邑赤聲。,Y,4010,,
M-R,2,郠,495,,,,,更,,,阝,,,,,琅邪莒邑。从邑更聲。《春秋傳》曰：“取郠。”,Y,4111,,
M-R,2,郡,5838,,,,,君,,,阝,,,,,周制：天子地方千里，分爲百縣，縣有四郡。故《春秋傳》曰“上大夫受郡”是也。至秦初置三十六郡，以監其縣。从邑君聲。,Y,3988,,
M-R,2,郢,1151,,,,,呈,,,阝,,,,,故楚都。在南郡江陵北十里。从邑呈聲。,Y,4074,,
M-R,2,郤,10838,,,,,谷,,,阝,,,,,晉大夫叔虎邑也。从邑谷聲。,Y,4038,,
M-R,2,部,1938,,,,,咅,,,阝,,,,,天水狄部。从邑咅聲。,Y,4021,in HSK,
M-R,2,郪,8248,,,,,妻,,,阝,,,,,新郪，汝南縣。从邑妻聲。,Y,4061,,
M-R,2,郫,8035,,,,,卑,,,阝,,,,,蜀縣也。从邑卑聲。,Y,4083,,
M-R,2,郭,4243,,,,,享,,,阝,,,,2024-01-28 11:52:25,齊之郭氏虚。善善不能進，惡惡不能退，是以亡國也。从邑𩫏聲。,Y,4133,in HSK,
M-R,2,郯,978,,,,,炎,,,阝,,,,,東海縣。帝少昊之後所封。从邑炎聲。,Y,4126,,
M-R,2,郰,13433,,,,,取,,,阝,,,,,魯下邑。孔子之鄉。从邑取聲。,Y,4116,,
M-R,2,郳,7643,,,,,兒,,,阝,,,,,齊地。从邑兒聲。《春秋傳》曰：“齊高厚定郳田。”,Y,4134,,
M-R,2,郴,2213,,,,,林,,,阝,,,,,桂陽縣。从邑林聲。,Y,4094,,
M-R,2,郹,5660,,,,,狊,,,阝,,,,,蔡邑也。从邑狊聲。《春秋傳》曰：“郹陽封人之女奔之。”,Y,4065,,
M-R,2,都,294,,,,,者,,,阝,,,,,有先君之舊宗廟曰都。从邑者聲。周禮：距國五百里爲都。,Y,3989,in HSK,
M-R,2,郾,11589,,,,,匽,,,阝,,,,,潁川縣。从邑匽聲。,Y,4059,,
M-R,2,郿,7201,,,,,眉,,,阝,,,,,右扶風縣。从邑眉聲。,Y,4004,,
M-R,2,鄂,449,,,,,㖾,,,阝,,,,,江夏縣。从邑㖾聲。,Y,4078,,
M-R,2,鄄,641,,,,,垔,,,阝,,,,,衞地。今濟陰鄄城。从邑垔聲。,Y,4106,,
M-R,2,鄅,1172,,,,,禹,,,阝,,,,,妘姓之國。从邑禹聲。《春秋傳》曰：“鄅人籍稻。”讀若規榘之榘。,Y,4112,,
M-R,2,鄈,6121,,,,,癸,,,阝,,,,,河東臨汾地，即漢之所祭后土處。从邑癸聲。,Y,4042,,
M-R,2,鄍,7432,,,,,冥,,,阝,,,,,晉邑也。从邑冥聲。《春秋傳》曰：“伐鄍三門。”,Y,4034,,
M-R,2,鄎,10839,,,,,息,,,阝,,,,,姬姓之國，在淮北。从邑息聲。今汝南新鄎。,Y,4062,,
M-R,2,鄏,8952,,,,,辱,,,阝,,,,,河南縣直城門官陌地也。从邑辱聲。《春秋傳》曰：“成王定鼎于郟鄏。”,Y,4023,,
M-R,2,鄐,397,,,,,畜,,,阝,,,,,晉邢矦邑。从邑畜聲。,Y,4035,,
M-R,2,鄑,13367,,,,,晉,,,阝,,,,,宋魯閒地。从邑晉聲。,Y,4104,,
M-R,2,鄗,4378,,,,,高,,,阝,,,,,常山縣。丗祖所卽位，今爲高邑。从邑高聲。,Y,4052,,
M-R,2,鄘,1153,,,,,庸,,,阝,,,,,南夷國。从邑庸聲。,Y,4082,,
M-R,2,鄙,1640,,,,,啚,,,阝,,,,,五酇爲鄙。从邑啚聲。,Y,3992,in HSK,
M-R,2,鄚,771,,,,,莫,,,阝,,,,,涿郡縣。从邑莫聲。,Y,4054,,
M-R,2,鄞,12028,,,,,堇,,,阝,,,,,會稽縣。从邑堇聲。,Y,4097,,
M-R,2,鄠,4595,,,,,雩,,,阝,,,,,右扶風縣名。从邑雩聲。,Y,4006,,
M-R,2,鄢,1101,,,,,焉,,,阝,,,,,南郡縣。孝惠三年改名宜城。从邑焉聲。,Y,4075,,
M-R,2,鄣,12763,,,,,章,,,阝,,,,,紀邑也。从邑章聲。,Y,4122,,
M-R,2,鄦,11292,,,,,無,,,阝,,,,,炎帝太嶽之胤，甫矦所封，在潁川。从邑無聲。讀若許。,Y,4057,,
M-R,2,鄫,1204,,,,,曾,,,阝,,,,,姒姓國。在東海。从邑曾聲。,Y,4129,,
M-R,2,鄬,10455,,,,,爲,,,阝,,,,,地名。从邑爲聲。,Y,4153,,
M-R,2,鄮,7172,,,,,貿,,,阝,,,,,會稽縣。从邑貿聲。,Y,4096,,
M-R,2,鄯,9159,,,,,善,,,阝,,,,,鄯善，西胡國也。从邑从善，善亦聲。,Y,3998,,
M-R,2,鄱,8169,,,,,番,,,阝,,,,,鄱陽，豫章縣。从邑番聲。,Y,4092,,
M-R,2,鄻,6561,,,,,輦,,,阝,,,,,周邑也。从邑輦聲。,Y,4024,,
M-R,2,鄾,12177,,,,,憂,,,阝,,,,,鄧國地也。从邑憂聲。《春秋傳》曰：“鄧南鄙鄾人攻之。”,Y,4067,,
M-R,2,酃,6744,,,,,霝,,,阝,,,,,長沙縣。从邑霝聲。,Y,4093,,
M-R,2,酅,10767,,,,,巂,,,阝,,,,,東海之邑。从邑巂聲。,Y,4128,,
M-R,2,酆,468,,,,,豐,,,阝,,,,,周文王所都。在京兆杜陵西南。从邑豐聲。,Y,4011,,
M-R,2,醜,13595,,,,,酉,,,鬼,,,,2024-01-20 23:12:20,可惡也。从鬼酉聲。,Y,,,
M-R,2,雂,8573,,,,,今,,,隹,,,,,鳥也。从隹今聲。《春秋傳》有公子苦雂。,Y,2292,,
M-R,2,雅,11488,,,,,牙,,,隹,,,,,楚烏也。一名鸒，一名卑居。秦謂之雅。从隹牙聲。,Y,2271,in HSK,
M-R,2,雉,13076,,,,,矢,,,隹,,,,,有十四種：盧諸雉，喬雉，鳪雉，鷩雉，秩秩海雉，翟山雉，翰雉，卓雉，伊洛而南曰翬，江淮而南曰搖，南方曰𢏚，東方曰钕，北方曰稀，西方曰蹲。从隹矢聲。,Y,2280,,
M-R,2,雊,4036,,,,,句,,,隹,,,,,雄雌鳴也。雷始動，雉鳴而雊其頸。从隹从句，句亦聲。,Y,2281,,
M-R,2,雌,2583,,,,,此,,,隹,,,,,鳥母也。从隹此聲。,Y,2305,in HSK,
M-R,2,雒,7031,,,,,各,,,隹,,,,,鵋䳢也。从隹各聲。,Y,2273,,
