zi,u_id,zi_left_up,zi_left,zi_left_down,zi_up,zi_mid,zi_down,zi_right_up,zi_right,zi_right_down,zi_mid_out,zi_mid_in,ts,desc_cn,is_active,id_shuowen,hsk_note,desc_en
半,1470,,,,丷,二,,,,,,丨,2024-01-14 15:06:05,物中分也。从八从牛。牛爲物大，可以分也。凡半之屬皆从半。,Y,724,in HSK,
燮,11126,火,,,言,,又,火,,,,,2024-01-21 09:17:16,和也。从言从又、炎。籒文𤎬从𢆉。𢆉，音飪。讀若溼。,Y,1902,,
寇,6017,,元,,宀,,,,攴,,,,2024-01-27 12:24:20,暴也。从攴从完。,Y,2035,in HSK,
鼓,4087,十,,豆,,支,,,,,,,2024-01-27 18:48:52,擊鼓也。从攴从壴，壴亦聲。,Y,2041,in HSK,
𠩺,10775,未,,,,,厂,攵,,,,,2024-01-21 08:39:13,坼也。从攴从厂。厂之性坼，果孰有味亦坼。故謂之𠩺，从未聲。,Y,2048,,
庸,12130,广,,,,肀,用,,,,,,2024-01-27 13:00:50,用也。从用从庚。庚，更事也。《易》曰：“先庚三日。”,Y,2076,in HSK,
瞿,8709,目,,,,,隹,目,,,,,2024-01-20 14:53:56,,Y,2351,,
敖,1356,土,,方,,,,,攵,,,,2024-01-27 17:09:41,出游也。从出从放。,Y,2504,,
死,9592,,夕,,一,,,,匕,,,,2024-01-15 13:23:27,澌也，人所離也。从歺从人。凡死之屬皆从死。,Y,2552,in HSK,
胤,12057,,丿,,幺,, 月,,乚,,,,2024-01-17 01:34:46,子孫相承續也。从肉；从八，象其長也；从幺，象重累也。,Y,2635,,
隋,960,,阝,,左,,月,,,,,,2024-01-17 01:24:03,裂肉也。从肉，从隓省。,Y,2660,,
筋,5453,,月,,⺮,,,,力,,,,2024-01-17 01:25:41,肉之力也。从力从肉从竹。竹，物之多筋者。凡筋之屬皆从筋。,Y,2729,in HSK,muscle
制,13019,⺧,,巾,,刂,,,,,,,2024-01-26 16:41:53,裁也。从刀从未。未，物成有滋味，可裁斷。一曰止也。,Y,2784,in HSK,
厚,4520,厂,,,,日,子,,,,,,2024-01-26 23:48:47,山陵之厚也。从𣆪从厂。,Y,3322,in HSK,
敫,5311,白,,方,,,,,攵,,,,2024-01-23 22:23:08,光景流也。从白从放。讀若龠。,Y,2505,,
向,11008,,,,丿,冂,,,,,,口,2024-01-15 13:29:25,北出牖也。从宀从口。《詩》曰：“塞向墐戶。”,Y,4539,in HSK,
冠,4132,,元,,冖,,,,寸,,,,2024-01-27 00:56:48,絭也。所以絭髮，弁冕之緫名也。从冂从元，元亦聲。冠有法制，从寸。,Y,4776,in HSK,
飾,13956,,饣,,,,,人,,巾,,,2024-01-21 11:35:58,㕞也。从巾从人，食聲。讀若式。一曰襐飾。,Y,4876,,
佩,7953,,亻,,,几,,,巾,,,帀,2024-01-26 16:24:49,大帶佩也。从人从凡从巾。佩必有巾，巾謂之飾。,Y,4936,in HSK,
咎,5609,久,,,,,口,人,,,,,2024-01-20 03:15:57,災也。从人从各。各者，相違也。,Y,5150,,
俞,12234,,,月,人,一,,,,刂,,,2024-01-21 22:08:02,空中木爲舟也。从亼从舟从巜。巜，水也。,Y,5413,,
兜,3146,,匚,,,白,儿,,㇆ 一,,,,2024-01-28 12:53:03,兜鍪，首鎧也。从𠑹，从皃省。皃象人頭也。,Y,5443,in HSK,
辟,1700,尸,,口,,,,,辛,,,,2024-01-27 21:29:49,法也。从卩从辛，節制其辠也；从口，用法者也。凡辟之屬皆从辟。,Y,5768,in HSK,
脊,299,二,𠦬,,,人,月,二,肉,,,,2024-01-27 10:04:50,背呂也。从𠦬从肉。,Y,8068,in HSK,rib
我,212,丿,扌,,,,,,戈,,,,2024-01-18 01:25:08,施身自謂也。或說我，頃頓也。从戈从𠄒。𠄒，或說古垂字。一曰古殺字。凡我之屬皆从我。,Y,8360,in HSK,I / self / me
亟,4921,,口,,,了,一,,又,,,,2024-01-21 19:06:31,敏疾也。从人从口，从又从二。二，天地也。,Y,8969,,
坐,13513,人,,,,土,,人,,,,,2024-01-18 22:08:41,止也。从土，从畱省。土，所止也。此與畱同意。,Y,9022,in HSK,sit
斝,5094,口,,,,冖,斗,口,,,,,2024-01-21 22:27:24,玉爵也。夏曰琖，殷曰斝，周曰爵。从吅从斗，冂象形。與爵同意。或說斝受六斗。,Y,9444,,
离,6426,,厹,,亠凵乂,厶,冂,,屮,,,,2024-01-25 21:45:02,山神，獸也。从禽頭，从厹从屮。歐陽喬說：离，猛獸也。,Y,9685,in HSK,
旅,6946,,方,,丿 一,,氏,,，,,,,2024-01-27 10:37:21,軍之五百人爲旅。从㫃从从。从，俱也。,Y,4282,in HSK,
族,13450,,方,,丿 一,,矢,,,,,,2024-01-27 13:07:03,矢鋒也。束之族族也。从㫃从矢。,Y,4283,in HSK,
先,10882,丿,,,土,儿,,,,,,,2024-01-15 13:28:54,前進也。从儿从之。凡先之屬皆从先。,Y,5444,in HSK,
整,12933,束,,,,,正,攵,,,,,2024-01-27 23:23:46,齊也。从攴从束从正，正亦聲。,Y,1995,in HSK,
堇,5462,,土,,廿,口,丰,,,,,,2024-01-18 22:12:05,黏土也。从土，从黃省。凡堇之屬皆从堇。,Y,9120,,
薻,12596,,氵,, 艹,,,,巢,,,,,水艸也。从艸从水，巢聲。《詩》曰：“于以采薻？”,Y,650,,
犨,2376,隹,,,,,牛,隹,,,,,2024-01-20 12:52:55,牛息聲。从牛雔聲。一曰牛名。,Y,749,,
犛,6408,未,,,, 厂,牛,攵,,,,,2024-01-20 12:56:06,西南夷長髦牛也。从牛𠩺聲。凡犛之屬皆从犛。,Y,774,,
哉,12541,十,,口,,,,,戈,,,,2024-01-18 21:00:07,言之閒也。从口𢦔聲。,Y,855,,
嗀,4846,士,冖 一,口,,,,,殳,,,,2024-01-18 21:04:04,歐皃。从口㱿聲。《春秋傳》曰：“君將嗀之。”,Y,937,,
咢,3323,口,,,,亏,,口,,,,,2024-01-25 02:08:52,譁訟也。从吅屰聲。,Y,973,,
得,2897,,彳,,日,一,寸,,,,,,2024-01-27 12:07:09,行有所得也。从彳㝵聲。,Y,1253,in HSK,
延,11540,,,廴,丿,止,,,,,,,2024-01-15 13:35:56,長行也。从㢟丿聲。,Y,1264,in HSK,
嗣,9602,口,,冊,,,,,司,,,,,諸侯嗣國也。从冊从口，司聲。,Y,1429,,
聿,12358,,,,彐,,二,,,,丨,,2024-02-18 19:41:50,所以書也。楚謂之聿，吳謂之不律，燕謂之弗。从𦘒一聲。凡聿之屬皆从聿。,Y,1932,,
翰,4327,十,日,十,,,,人,,羽,,,2024-01-21 01:19:05,天雞赤羽也。从羽倝聲。《逸周書》曰：“大翰，若翬雉，一名鷐風。周成王時蜀人獻之。”,Y,2235,in HSK,
雗,4334,十 ,日,十 ,,,,丿 一,隹,,,,2024-01-20 15:14:55,雗鷽也。从隹倝聲。,Y,2279,,
雁,11628,厂,亻,,,隹,,,,,,,,鳥也。从隹从人，厂聲。讀若鴈。,Y,2293,in HSK,
觳,4565,士,冖一,角,,,,,殳,,,,2024-01-20 21:10:18,盛觵卮也。一曰射具。从角㱿聲。讀若斛。,Y,2852,,
微,10418,,彳,,山,一,几,,攵,,,,2024-01-27 19:11:36,隱行也。从彳𢼸聲。《春秋傳》曰：“白公其徒微之。”,Y,1235,in HSK,
德,2899,,彳,,十,罒,一 心,,,,,,2024-01-27 22:51:39,升也。从彳㥁聲。,Y,1223,in HSK,
戴,2772,十,,異,,,,,戈,,,,2024-01-27 22:50:30,分物得增益曰戴。从異𢦔聲。,Y,1771,in HSK,
殿,3024,尸,,共,,,,,殳,,,,2024-01-23 21:54:44,擊聲也。从殳𡱂聲。,Y,1959,in HSK,
尚,9181,,,,小,冂,,,,,,口,2024-01-26 16:29:19,曾也。庶幾也。从八向聲。,Y,711,in HSK,
瞒,7084,,目,,艹,两,,,,,,,2024-01-27 21:48:08,平目也。从目㒼聲。,Y,2101,in HSK,
巽,11445,己,,,,,共,己,,,,,2024-02-04 18:51:45,具也。从丌𠨎聲。,Y,3010,,
南,7573,,,,十,冂,丫,,𢆉,,,二,2024-01-27 00:08:51,艸木至南方，有枝任也。从𣎵𢆉聲。,Y,3857,in HSK,
梁,6574,氵,,,,,木,刅,,,,,,水橋也。从木从水，刅聲。,Y,3768,in HSK,
榖,4062,士,冖 一,木,,,,,殳,,,,2024-01-23 21:56:06,楮也。从木㱿聲。,Y,3507,,
羸,6353,,,月,亡,口,羊,,,凡,,,2024-01-20 18:14:51,瘦也。从羊𣎆聲。,Y,2340,,
朴,8212,,木,,,,,,,,,,2024-01-15 13:17:32,木皮也。从木卜聲。,Y,3555,in HSK,
鷇,6024,士,冖一,鸟,,,,,殳,,,,2024-01-20 18:05:02,鳥子生哺者。从鳥𣪊聲。,Y,2470,,
粲,1983,歺,,,,,米,又,,,,,2024-01-21 16:06:24,稻重一䄷，爲粟二十斗，爲米十斗，曰毇；爲米六斗太半斗，曰粲。从米𣦼聲。,Y,4458,,
稽,4894,,禾,,尤,,旨,,,,,,2024-01-25 21:14:32,畱止也。从𥝌从尤，旨聲。凡稽之屬皆从稽。,Y,3873,in HSK,
旗,8268,,方,,丿 一,其,,,,,,,2024-01-27 21:53:45,熊旗五游，以象罰星，士卒以爲期。从㫃其聲。《周禮》曰：“率都建旗。”,Y,4263,in HSK,
机,210,,木,,,,,,,,,,2024-01-15 12:51:06,木也。从木几聲。,Y,3533,in HSK,
餐,1970,歺,,,,,食,又,,,,,2024-01-27 22:47:07,吞也。从食𣦼聲。,Y,3212,in HSK,
栽,77,十,,木,,,,,戈,,,,2024-01-18 16:51:29,築牆長版也。从木𢦔聲。《春秋傳》曰：“楚圍蔡，里而𣒭。”,Y,3601,in HSK,plant
黱,2787,,月,,丷,夫,黑,,,,,,2024-01-21 21:37:07,畫眉也。从黑朕聲。,Y,6536,,
峱,7600,,犭,,丑,,山,,,,,,2024-01-20 05:09:20,山，在齊地。从山狃聲。《詩》曰：“遭我于峱之間兮。”,Y,5823,,
布,1928,丿,,,一,巾,,,,,,,2024-01-14 15:14:47,枲織也。从巾父聲。,Y,4888,in HSK,
淫,12024,,氵,,爫,,壬,,,,,,2024-01-28 13:21:09,侵淫隨理也。从水㸒聲。一曰久雨爲淫。,Y,7186,in HSK,
滕,983,,月,,丷,夫,水 ,,,,,,2024-01-18 01:49:19,水超涌也。从水朕聲。,Y,7135,,
裁,1948,十,,衣,,,,,戈,,,,2024-01-18 23:55:37,制衣也。从衣𢦔聲。,Y,5231,in HSK,tailor / dictate
襄,10985,,,,,衣,,,,,,,2024-01-18 23:57:37,漢令：解衣耕謂之襄。从衣𤕦聲。,Y,5298,incomplete,
漦,6404,未,,,, 厂,水,攵,,,,,2024-01-18 01:50:38,順流也。一曰水名。从水𠩺聲。,Y,7108,,
宿,9680,,亻,,宀,百,,,,,,,2024-01-27 12:44:46,止也。从宀𠈇聲。𠈇，古文夙。,Y,4581,in HSK,
奥,1376,,,,丿,冂,大,,,,,米,2024-01-25 01:38:12,宛也。室之西南隅。从宀𢍏聲。,Y,4542,in HSK,
嫠,6397,未,,,,厂,女,攵,,,,,2024-01-18 21:27:37,無夫也。从女𠩺聲。,Y,8312,,
柩,5615,,木,,,,,,,,匸,久,,棺也。从匚从木，久聲。,Y,8399,,
彀,4029,士,冖 一,弓,,,,,殳,,,,2024-01-21 21:51:49,張弩也。从弓𣪊聲。,Y,8457,,
縠,4560,士,冖一,糸,,,,,殳,,,,2024-01-21 00:49:24,細縛也。从糸𣪊聲。,Y,8552,,
蠜,3457,木 ,,,爻,大,虫,木 ,,,,,2024-01-18 22:26:49,𨸏蠜也。从虫樊聲。,Y,8794,,
蠃,7019,,,月,亡,口,虫,,,凡,,,2024-01-18 22:27:54,蜾蠃也。从虫𣎆聲。一曰虒蝓。,Y,8810,,
塍,2262,,月,,丷,夫,土,,,,,,2024-01-18 22:14:12,稻中畦也。从土朕聲。,Y,8996,,
在,120,,,,,土,,,,,,,2024-01-15 12:43:24,存也。从土才聲。,Y,9021,in HSK,
新,11150,立,,木,,,,,斤,,,,2024-01-21 22:25:08,取木也。从斤新聲。,Y,9440,in HSK,
成,2264,,,,,,,,戊,,,,2024-01-15 12:56:46,就也。从戊丁聲。,Y,9700,"in HSK, incomplete",
存,2696,,,,,子,,,,,,,2024-01-15 13:00:00,恤問也。从子才聲。,Y,9729,"in HSK, incomplete",
涅,7726,,氵,,日,,土,,,,,,,黑土在水中也。从水从土，日聲。,Y,7197,,
瑟,9069,王,,,,,必,王,,,,,2024-01-28 15:09:30,庖犧所作弦樂也。从珡必聲。,Y,8365,in HSK,
孤,4043,,子,,,,,,,,,,2024-11-30 22:55:32,,Y,9728,,
然,8810,月,,,,,灬,犬,,,,,2024-01-18 23:39:02,燒也。从火肰聲。,Y,6389,in HSK,
毁,43,臼,,工,,殳,,,,,,,2024-01-27 18:33:16,,Y,,from HSK,to destroy;  to ruin/to defame
锁,65,,钅,,小,贝,,,,,,,2024-01-27 17:06:40,,Y,,from HSK,to lock;  to lock up/a lock (CL:把[ba3])
获,110,,犭,,艹,,,,犬,,,,2024-01-27 08:31:05,,Y,,from HSK,(literary) to catch;  to capture/(literary) to get;  (bound form) to reap;  to harvest
石,183,丿,,,一,口,,,,,,,2024-01-14 15:02:29,,Y,,from HSK,dry measure for grain equal to ten dou 斗[dou3];  one hundred liters/ancient pr. [shi2]
满,740,,氵,,艹,两,,,,,,,2024-01-27 21:27:21,,Y,,from HSK,Manchu ethnic group
那,777,,,,,,,,阝,,,,2024-01-16 22:45:27,,Y,,"from HSK, incomplete",surname Na
瘪,1795,疒,,,,自,仑,,,,,,2024-01-25 01:42:59,,Y,,from HSK,deflated/shriveled/sunken/empty
厨,2426,厂,,,,豆,,,寸,,,,2024-01-25 01:55:43,,Y,,from HSK,kitchen
船,2478,,舟,,八,,口,,,,,,2024-01-27 12:04:49,,Y,,from HSK,"boat/vessel/ship/CL:條|条[tiao2],艘[sou1],隻|只[zhi1]"
春,2522,,,,,三,日,,,,,八,2024-01-26 17:00:04,,Y,,from HSK,spring (season)/gay/joyful/youthful/love/lust/life
囱,2603,,,,丿,囗,,,,,,夕,2024-02-10 17:43:55,,Y,,from HSK,chimney
弟,2977,,,丿,丷,弔,,,,,,,2024-01-18 02:03:38,,Y,,from HSK,younger brother/junior male/I (modest word in letter)
段,3218,,,,,殳,,,,,,,2024-01-26 23:41:58,,Y,,from HSK / incomplete,"paragraph/section/segment/stage (of a process)/classifier for stories, periods of time, lengths of thread etc"
罚,3415,,讠,,罒,,,,刂,,,,2024-01-26 23:42:51,,Y,,from HSK,to punish/to penalize
繁,3452,每,,,,,糸,攵,,,,,2024-01-27 22:54:25,,Y,,from HSK,"complicated/many/in great numbers/abbr. for 繁體|繁体[fan2 ti3], traditional form of Chinese characters"
侯,4506,,亻,,乛 一,,矢,,,,,,2024-01-27 17:27:39,,Y,,from HSK,"marquis, second of the five orders of ancient Chinese nobility 五等爵位[wu3 deng3 jue2 wei4]/nobleman; high official"
监,5130,丨 丨,,,,,皿,丿 一 丶,,,,,2024-01-27 09:00:53,,Y,,from HSK,to supervise/to inspect/jail/prison
鉴,5226,丨 丨,,,,,金,丿 一 丶,,,,,2024-01-27 18:51:57,,Y,,from HSK,bronze mirror (used in ancient times)/to reflect/to mirror/sth that serves as a warning or a lesson/to examine/to scrutinize
将,5234,,丬,,夕,,寸,,,,,,2024-01-27 01:00:44,,Y,,from HSK,"will/shall/to use/to take/to checkmate/just a short while ago/(introduces object of main verb, used in the same way as 把[ba3])"
浆,5238,丬,,,,,水,夕,,,,,2024-01-27 09:04:41,,Y,,from HSK,thick liquid/to starch
解,5426,,角,,刀,,牛,,,,,,2024-01-27 18:52:34,,Y,,from HSK,to divide/to break up/to split/to separate/to dissolve/to solve/to melt/to remove/to untie/to loosen/to open/to emancipate/to explain/to understand/to know/a solution/a dissection
金,5458,,,,人,王,,,,,,丷,2024-01-26 16:07:52,,Y,,from HSK,gold/chemical element Au/generic term for lustrous and ductile metals/money/golden/highly respected/one of the eight categories of ancient musical instruments 八音[ba1 yin1]
局,5651,,,,尸,㇆,,,,,,口,2024-01-18 02:16:38,,Y,,from HSK,"office/situation/classifier for games: match, set, round etc"
举,5675,,,,兴,二,,,,,,丨,2024-01-27 01:06:10,,Y,,from HSK,to lift/to hold up/to cite/to enumerate/to act/to raise/to choose/to elect/act/move/deed
楞,6385,,木,,罒,,方,,,,,,2024-01-28 15:01:10,,Y,,from HSK,"variant of 稜|棱[leng2], corner/square beam/edge/arris (curve formed by two surfaces meeting at an edge)/used in 楞迦[Leng2 jia1], Sri Lanka"
黎,6430,禾,,,,人,水,勹 丿,,,,,2024-01-27 21:45:13,,Y,,from HSK,(literary) black/dark/many/multitude
炼,6568,,火,,,东,,,,,,一,2024-01-27 01:08:47,,Y,,from HSK,to refine/to smelt
隆,6811,,阝,,夂,一,生,,,,,,2024-01-25 21:55:04,,Y,,from HSK,sound of drums
卤,6889,,,,卜,囗,,,,,,乂,2024-01-27 23:53:43,,Y,,from HSK,to stew in soy sauce and spices
率,6962,冫,,,玄,,十,冫,,,,,2024-01-25 22:24:22,,Y,,from HSK,rate/frequency
骂,7058,口,,,,,马,口,,,,,2024-01-27 00:04:01,,Y,,from HSK,"to scold/to abuse/to curse/CL:通[tong4],頓|顿[dun4]"
铅,8389,,钅,,几,,口,,,,,,2024-01-27 09:13:25,,Y,,from HSK,lead (chemistry)
乾,8398,十,日,十,,乞,,,,,,,2024-01-28 12:05:11,,Y,,from HSK,"one of the Eight Trigrams 八卦[ba1 gua4], symbolizing heaven/male principle/☰/ancient Chinese compass point: 315° (northwest)"
琴,8566,王,,,,,今,王,,,,,2024-01-27 12:35:42,,Y,,from HSK,guqin 古琴[gu3 qin2] (a type of zither)/musical instrument in general
寝,8576,,丬,,宀,彐 冖,又,,,,,,2024-01-28 15:08:13,,Y,,from HSK,to lie down
散,9027,井,,月,,攵,,,,,,,2024-01-27 17:45:58,,Y,,from HSK,scattered/loose/to come loose/to fall apart/leisurely/powdered medicine
涩,9065,,氵,,刃,,止,,,,,,2024-01-28 12:06:53,,Y,,from HSK,astringent/tart/acerbity/unsmooth/rough (surface)/hard to understand/obscure
煞,9085,刍,,,,,灬,攵,,,,,2024-01-28 15:09:50,,Y,,from HSK,to terminate/to cut short/to bring to a stop/to squeeze/to tighten/to damage/variant of 殺|杀[sha1]
术,9512,,,,,木,,丶,,,,,2024-01-15 12:15:37,,Y,,from HSK,method/technique
竖,9514,丨丨,,,,,立,又,,,,,2024-01-27 00:17:32,,Y,,from HSK,to erect/vertical/vertical stroke (in Chinese characters)
刷,9517,尸,,巾,,,,,刂,,,,2024-01-26 22:55:05,,Y,,from HSK,to brush/to paint/to daub/to paste up/to skip class (of students)/to fire from a job
肃,9695,,,丿,肀,八,,,,丨,,,2024-01-26 22:56:23,,Y,,from HSK,respectful/solemn/to eliminate/to clean up
拖,10270,,扌,,丿 一,,也,,,,,,2024-01-26 16:33:59,,Y,,from HSK,to drag/to tow/to trail/to hang down/to mop (the floor)/to delay/to drag on
望,10408,亡,,,,,王,月,,,,,2024-01-27 12:53:54,,Y,,from HSK,full moon/to hope/to expect/to visit/to gaze (into the distance)/to look towards/towards
为,10449,丶,,,,力,,,,,,丶,2024-01-14 14:42:45,,Y,,from HSK,as (in the capacity of)/to take sth as/to act as/to serve as/to behave as/to become/to be/to do/by (in the passive voice)
尉,10495,尸,,示,,,,,寸,,,,2024-01-21 18:51:28,,Y,,from HSK,military officer
武,10641,一,,止,,,,,弋,,,,2024-01-23 22:55:15,,Y,,from HSK,martial/military
薛,11386,,,,艹,,,,辛,,,,2024-01-28 13:38:18,,Y,,from HSK / incomplete,wormwood like grass (classical)
压,11463,厂,,,,土,,,,,,丶,2024-01-15 13:34:52,,Y,,from HSK,to press/to push down/to keep under (control)/pressure
燕,11612,,,,廿,北,灬,,,,,口,2024-01-27 23:19:29,,Y,,from HSK,swallow (family Hirundinidae)/old variant of 宴[yan4]
扬,11649,,扌,,,,,,,,,,2024-01-15 13:36:53,,Y,,"from HSK, incomplete",to raise/to hoist/the action of tossing or winnowing/scattering (in the wind)/to flutter/to propagate
杨,11653,,木,,,,,,,,,,2024-01-17 00:06:44,,Y,,"from HSK, incomplete",poplar
羊,11659,,,,丷, 三,,,,,,丨,2024-01-15 13:37:22,,Y,,from HSK,"sheep; goat/CL:頭|头[tou2],隻|只[zhi1]"
夜,11763,,亻,,亠,夂,,,,,,丶,2024-01-26 23:05:53,,Y,,from HSK,night
尤,12180,,,,,尢,,丶,,,,,2024-01-14 14:49:09,,Y,,from HSK,"outstanding/particularly, especially/a fault/to express discontentment against"
载,12548,十,,车,,,,,戈,,,,2024-01-27 01:34:10,,Y,,from HSK,to record in writing/to carry (i.e. publish in a newspaper etc)/Taiwan pr. [zai4]/year
赞,12572,先,,,,,贝,先,,,,,2024-01-27 23:22:44,,Y,,from HSK,to patronize/to support/to praise/(Internet slang) to like (an online post on Facebook etc)
展,12728,,,,尸,,,,,,,,2024-01-25 22:04:37,,Y,,"from HSK, incomplete",to spread out/to open up/to exhibit/to put into effect/to postpone/to prolong/exhibition
周,13110,,,,土,,口,,,,冂,,2024-01-26 16:46:42,,Y,,from HSK,to make a circuit/to circle/circle/circumference/lap/cycle/complete/all/all over/thorough/to help financially
咒,13135,口,,,,,几,口,,,,,2024-01-28 11:11:48,,Y,,from HSK,incantation/magic spell/curse/malediction/to revile/to put a curse on sb
朱,13153,丿,,,一,木,,,,,,,2024-01-15 13:44:01,,Y,,from HSK,vermilion
足,13451,,,,口 ,,,,,,,,2024-01-17 00:19:05,,Y,,"from HSK, incomplete",foot/to be sufficient/ample
左,13508,丿,,,一,工,,,,,,,2024-01-15 12:38:42,,Y,,from HSK,left/the Left (politics)/east/unorthodox/queer/wrong/differing/opposite/variant of 佐[zuo3]
替,10015,夫,,,,,日,夫,,,,,2024-01-27 12:47:58,,Y,,from HSK,to substitute for/to take the place of/to replace/for/on behalf of/to stand in for
畏,10502,,,,田,,,,,,,,2024-01-27 00:23:02,,Y,,from HSK / incomplete,to fear
徙,10792,,彳,,止,,疋,,,,,,2024-01-28 13:10:27,,Y,,from HSK,(literary) to change one's residence
贤,10921,丨 丨,,,,,贝,又,,,,,2024-01-26 16:35:18,,Y,,from HSK,worthy or virtuous person/honorific used for a person of the same or a younger generation
卸,11111,午,,止,,,,,卩,,,,2024-01-27 00:28:52,,Y,,from HSK,to unload/to unhitch/to remove or strip/to get rid of
盐,11561,土,,,,,皿,卜,,,,,2024-01-27 01:29:44,,Y,,from HSK,salt/CL:粒[li4]
亦,11884,,,,亠,,,,,,,,2024-01-15 13:39:29,,Y,,"from HSK, incomplete",also
绎,11938,,纟,,又,二,,,,,,丨,2024-01-28 11:04:44,,Y,,from HSK,continuous/to interpret/to unravel/to draw silk (old)
肄,11944,匕,,矢,,聿,,,,,,,2024-01-28 15:17:05,,Y,,from HSK,to learn/to practice or study (old)
译,11966,,讠,,又,二,,,,,,丨,2024-01-23 22:59:16,,Y,,from HSK,to translate/to interpret
婴,12066,贝,,,,,女,贝,,,,,2024-01-27 22:05:53,,Y,,from HSK,infant/baby
鹰,12086,广,,,,亻 隹,鸟,,,,,,2024-01-27 23:21:57,,Y,,from HSK,eagle/falcon/hawk
赢,12108,,,月,亡,口,贝,,,凡,,,2024-01-27 23:22:29,,Y,,from HSK,to beat/to win/to profit
颖,12114,匕,,禾,,页,,,,,,,2024-01-28 15:17:20,,Y,,from HSK,head of grain/husk/tip/point/clever/gifted/outstanding
缘,12427,,纟,,彑,豕,,,,,,,2025-01-16 23:43:22,,Y,,from HSK,cause/reason/karma/fate/predestined affinity/margin/hem/edge/along
择,12620,,扌,,又,二,,,,,,丨,2024-01-26 16:38:26,,Y,,from HSK,to select/to choose/to pick over/to pick out/to differentiate/to eliminate/also pr. [zhai2]
泽,12622,,氵,,又,二,,,,,,丨,2024-01-26 23:09:41,,Y,,from HSK,pool/pond/(of metals etc) luster/favor or beneficence/damp/moist
蘸,12749,,酉,,艹,,,,焦,,,,2024-01-28 13:56:48,,Y,,from HSK,"to dip in (ink, sauce etc)"
疹,12889,疒,,,,人,彡,,,,,,2024-01-28 12:35:52,,Y,,from HSK,measles/rash
癌,1289,疒,,,,品,山,,,,,,2024-01-25 01:35:51,,Y,,from HSK,cancer/carcinoma/also pr. [yan2]
诊,12895,,讠,,人,,彡,,,,,,2024-01-23 23:03:12,,Y,,from HSK,to examine or treat medically
质,13064,厂,,,,十,贝,,,,,,2024-01-26 16:42:32,,Y,,from HSK,character/nature/quality/plain/to pawn/pledge/hostage/to question/Taiwan pr. [zhi2]
贮,13225,,贝,,宀,,一,,,,,,2024-01-28 11:12:47,,Y,,from HSK,to store/to save/stockpile/Taiwan pr. [zhu3]
走,13439,,,,土,,,,,,,,2024-01-17 00:18:38,,Y,,"from HSK, incomplete","to walk/to go/to run/to move (of vehicle)/to visit/to leave/to go away/to die (euph.)/from/through/away (in compound verbs, such as 撤走[che4 zou3])/to change (shape, form, meaning)"
报,1530,,扌,,,卩, 又,,,,,,2024-01-16 22:52:41,,Y,,from HSK,"to announce/to inform/report/newspaper/recompense/revenge/CL:份[fen4],張|张[zhang1]"
碧,1679,王,,,,,石,白,,,,,2024-01-27 21:29:22,,Y,,from HSK,green jade/bluish green/blue/jade
哭,19,口,,,,,犬,口,,,,,2024-01-27 08:28:06,,Y,,from HSK,to cry;  to weep
簿,1937,,氵,,⺮,甫,寸,,,,,,2024-01-28 13:29:16,,Y,,from HSK,a book/a register/account-book
鼠,201,,,𠄌 丶 丶,臼,,𠄌 丶 丶,,,𠄌,,,2024-01-27 18:34:54,,Y,,from HSK,(bound form) rat;  mouse
册,2013,,⺆,,,,,,⺆,,,一,2024-01-28 10:38:07,,Y,,from HSK,book/booklet/classifier for books
搀,2084,,扌,,免,,冫,,,,,,2024-01-28 12:48:18,,Y,,from HSK,to take by the arm and assist/to mix/to blend/to dilute/to adulterate
缠,2105,,纟,,广,里,,,,,,,2024-01-27 21:31:25,,Y,,from HSK,to wind around/to wrap round/to coil/tangle/to involve/to bother/to annoy
馋,2113,,饣,,,免,冫,,,,,,2024-01-27 17:15:27,,Y,,from HSK,gluttonous/greedy/to have a craving
鬼,243,,,,丿,田,儿,,,,,厶,2024-01-26 23:25:06,,Y,,from HSK,disembodied spirit;  ghost
串,2483,,,,口,,口,,,,丨,,2024-01-16 22:57:04,,Y,,from HSK,"to string together/to skewer/to connect wrongly/to gang up/to rove/string/bunch/skewer/classifier for things that are strung together, or in a bunch, or in a row: string of, bunch of, series of/to make a swift or abrupt linear movement (like a bead on an abacus)/to move across"
戳,2548,羽,,隹,,戈,,,,,,,2024-01-28 13:30:17,,Y,,from HSK,to jab/to poke/to stab/(coll.) to sprain/to blunt/to fuck (vulgar)/to stand/to stand (sth) upright/stamp/seal
第,2988,,,丿,⺮,弔,,,,,,,2024-01-27 12:07:44,,Y,,from HSK,"""(prefix indicating ordinal number, as in 第六[di4 liu4] """"sixth"""")/(literary) grades in which successful candidates in the imperial examinations were placed/(old) residence of a high official/(literary) but; however/(literary) only; just"""
盾,3254,厂,,,,十,目,,,,,,2024-01-26 23:42:30,,Y,,from HSK,"shield/(currency) Vietnamese dong/currency unit of several countries (Indonesian rupiah, Dutch gulden etc)"
惰,3287,,忄,,左,,月,,,,,,2024-01-27 18:46:22,,Y,,from HSK,lazy
噩,3326,口,,口,,,,口,,口,王,,2024-01-25 02:07:58,,Y,,from HSK,startling
贰,3404,,二,贝,,,,,弋,,,,2024-01-28 10:12:02,,Y,,from HSK,two (banker's anti-fraud numeral)/to betray
敢,3827,乛,耳,,,攵,,,,,,,2024-01-27 12:09:49,,Y,,from HSK,to dare/daring/(polite) may I venture
箍,4046,,,扌,⺮,,匝,,,,,,2024-01-25 08:33:45,,Y,,from HSK,hoop/to bind with hoops
候,4519,,亻 丨,,乛 一,,矢,,,,,,2024-01-27 08:58:24,,Y,,from HSK,to wait/to inquire after/to watch/season/climate/(old) period of five days
徽,4742,,彳,,山,,糸,,攵,,,,2024-01-25 21:13:57,,Y,,from HSK,badge/emblem/insignia/crest/logo/coat of arms
坚,5112,丨 丨,,,,,土,又 ,,,,,2024-01-16 23:11:19,,Y,,from HSK,strong/solid/firm/unyielding/resolute
拣,5160,,扌,,,东,,,,,,一,2024-01-26 16:07:12,,Y,,from HSK,to choose/to pick/to sort out/to pick up
桨,5252,丬,,,,,木,夕,,,,,2024-01-27 09:04:58,,Y,,from HSK,oar/paddle
奖,5253,丬,,,,,大,夕,,,,,2024-01-27 01:01:09,,Y,,from HSK,prize/award/encouragement/CL:個|个[ge4]
酱,5271,丬,,,,,酉,夕,,,,,2024-01-27 18:52:15,,Y,,from HSK,thick paste of fermented soybean/marinated in soy paste/paste/jam
韩,531,十,日,十,,韦,,,,,,,2024-01-28 12:45:42,,Y,,from HSK,"Han, one of the Seven Hero States of the Warring States 戰國七雄|战国七雄/Korea from the fall of the Joseon dynasty in 1897/Korea, esp. South Korea 大韓民國|大韩民国/surname Han"
截,5398,十,,隹,,戈,,,,,,,2024-01-27 21:42:29,,Y,,from HSK,to cut off (a length)/to stop/to intercept/section/chunk/length
紧,5468,丨 丨,,,,,糸,又,,,,,2024-01-27 09:07:16,,Y,,from HSK,tight/strict/close at hand/near/urgent/tense/hard up/short of money/to tighten
浸,5481,,氵,,彐,冖,又,,,,,,2024-01-27 10:30:17,,Y,,from HSK,to immerse/to soak/to steep/gradually
腾,56,,月,,丷,夫,马,,,,,,2024-01-27 18:33:51,,Y,,from HSK,(bound form) to gallop;  to prance/(bound form) to soar
爵,5774,,,艮,爫,罒,,,,寸,,,2024-01-25 21:30:28,,Y,,from HSK,ancient bronze wine holder with 3 legs and loop handle/nobility
款,6073,士,,示,,欠,,,,,,,2024-01-27 12:24:39,,Y,,from HSK,"section/paragraph/funds/CL:筆|笔[bi3],個|个[ge4]/classifier for versions or models (of a product)"
览,6265,丨 丨,,,,,见,丿 一 丶,,,,,2024-01-28 12:43:49,,Y,,from HSK / incomplete,to look at/to view/to read
练,6569,,纟,,,东,,,,,,一,2024-01-26 22:43:16,,Y,,from HSK,to practice/to train/to drill/to perfect (one's skill)/exercise/(literary) white silk/to boil and scour raw silk
